{
  "id": "opencode-native",
  "adapter": "opencode-native",
  "identity": {
    "id": "opencode-native",
    "version": "native-config-v4"
  },
  "capabilities": [
    "shell",
    "workspace_edit",
    "mcp",
    "session_export",
    "native_config"
  ],
  "configuration": {
    "timeout_seconds": 600,
    "strict_executable": true
  }
}
