{
  "id": "codex-sol",
  "adapter": "codex",
  "identity": {
    "id": "codex-sol",
    "version": "gpt-5.6-sol-high-v1"
  },
  "capabilities": [
    "shell",
    "workspace_edit",
    "mcp",
    "jsonl_trace"
  ],
  "configuration": {
    "model": "gpt-5.6-sol",
    "reasoning_effort": "high",
    "local_provider": null,
    "timeout_seconds": 600
  }
}
