{
  "id": "gemma4-12b-ollama",
  "adapter": "codex",
  "identity": {
    "id": "gemma4-12b-ollama",
    "version": "gemma4-12b-ollama-v1"
  },
  "capabilities": [
    "shell",
    "workspace_edit",
    "mcp",
    "jsonl_trace",
    "local_model"
  ],
  "configuration": {
    "model": "gemma4:12b",
    "reasoning_effort": null,
    "local_provider": "ollama",
    "timeout_seconds": 600
  }
}
